[WARN] OCR not available
2025-11-05 19:42:56,613 - faiss.loader - INFO - Loading faiss with AVX512 support.
2025-11-05 19:42:56,613 - faiss.loader - INFO - Could not load library with AVX512 support due to:
ModuleNotFoundError("No module named 'faiss.swigfaiss_avx512'")
2025-11-05 19:42:56,613 - faiss.loader - INFO - Loading faiss with AVX2 support.
2025-11-05 19:42:56,624 - faiss.loader - INFO - Successfully loaded faiss with AVX2 support.
2025-11-05 19:42:56,629 - am_common - INFO - Loading config: config\batch_full.yaml
2025-11-05 19:42:56,643 - am_common - INFO - Config loaded successfully
2025-11-05 19:42:56,643 - quality_tracker - INFO - Quality tracker initialized: c:\scripts\1repo\data\quality
2025-11-05 19:42:56,644 - __main__ - INFO - ============================================================
2025-11-05 19:42:56,644 - __main__ - INFO -   🚀 archivist magika 2.0.0
2025-11-05 19:42:56,644 - __main__ - INFO - ============================================================
2025-11-05 19:42:56,644 - __main__ - INFO - Quality check: enabled
2025-11-05 19:42:56,644 - __main__ - INFO - Validation: enabled
2025-11-05 19:42:56,644 - __main__ - INFO - Dry run: no
2025-11-05 19:42:56,644 - __main__ - INFO - Starting: run_single_pipeline
2025-11-05 19:42:56,644 - __main__ - INFO - Processing: Ядро 2025-08-29.pdf
2025-11-05 19:42:56,644 - __main__ - INFO - Pipeline: structural → embed
2025-11-05 19:42:56,644 - __main__ - INFO - Stages: structural → structure_detect → summarize → extended → finalize → chunk → embed
2025-11-05 19:42:56,644 - __main__ - INFO - ============================================================
2025-11-05 19:42:56,644 - __main__ - INFO -   📄 Starting: STRUCTURAL
2025-11-05 19:42:56,644 - __main__ - INFO - ============================================================
2025-11-05 19:42:56,644 - am_common - INFO - Loading config: config\batch_full.yaml
2025-11-05 19:42:56,659 - am_common - INFO - Config loaded successfully
2025-11-05 19:42:56,659 - am_structural_robust - INFO - Text extractor chain: ['pdfminer', 'pdfplumber', 'pypdf2']
2025-11-05 19:42:56,659 - am_structural_robust - INFO - Table extractor chain: ['pdfplumber']
2025-11-05 19:42:56,659 - am_structural_robust - INFO - Processing: Ядро 2025-08-29.pdf
2025-11-05 19:42:57,369 - am_structural_robust - INFO - PDF: Ядро 2025-08-29
2025-11-05 19:42:57,807 - am_structural_robust - INFO - Total pages: 1660
2025-11-05 19:43:48,099 - am_structural_robust - INFO -   Processed 50/1660 pages
2025-11-05 19:44:01,140 - pdfminer.pdfinterp - WARNING - Cannot set gray non-stroke color because /'P135' is an invalid float value
2025-11-05 19:44:01,141 - pdfminer.pdfinterp - WARNING - Cannot set gray non-stroke color because /'P143' is an invalid float value
2025-11-05 19:44:01,142 - pdfminer.pdfinterp - WARNING - Cannot set gray non-stroke color because /'P151' is an invalid float value
2025-11-05 19:44:01,899 - pdfminer.pdfinterp - WARNING - Cannot set gray non-stroke color because /'P135' is an invalid float value
2025-11-05 19:44:01,900 - pdfminer.pdfinterp - WARNING - Cannot set gray non-stroke color because /'P143' is an invalid float value
2025-11-05 19:44:01,901 - pdfminer.pdfinterp - WARNING - Cannot set gray non-stroke color because /'P151' is an invalid float value
2025-11-05 19:44:03,103 - pdfminer.pdfinterp - WARNING - Cannot set gray non-stroke color because /'P163' is an invalid float value
2025-11-05 19:44:03,103 - pdfminer.pdfinterp - WARNING - Cannot set gray non-stroke color because /'P194' is an invalid float value
2025-11-05 19:44:03,103 - pdfminer.pdfinterp - WARNING - Cannot set gray non-stroke color because /'P225' is an invalid float value
2025-11-05 19:44:03,104 - pdfminer.pdfinterp - WARNING - Cannot set gray non-stroke color because /'P256' is an invalid float value
2025-11-05 19:44:03,104 - pdfminer.pdfinterp - WARNING - Cannot set gray non-stroke color because /'P287' is an invalid float value
2025-11-05 19:44:03,104 - pdfminer.pdfinterp - WARNING - Cannot set gray non-stroke color because /'P318' is an invalid float value
2025-11-05 19:44:03,104 - pdfminer.pdfinterp - WARNING - Cannot set gray non-stroke color because /'P349' is an invalid float value
2025-11-05 19:44:03,104 - pdfminer.pdfinterp - WARNING - Cannot set gray non-stroke color because /'P380' is an invalid float value
2025-11-05 19:44:03,104 - pdfminer.pdfinterp - WARNING - Cannot set gray non-stroke color because /'P411' is an invalid float value
2025-11-05 19:44:03,104 - pdfminer.pdfinterp - WARNING - Cannot set gray non-stroke color because /'P442' is an invalid float value
2025-11-05 19:44:03,104 - pdfminer.pdfinterp - WARNING - Cannot set gray non-stroke color because /'P473' is an invalid float value
2025-11-05 19:44:03,104 - pdfminer.pdfinterp - WARNING - Cannot set gray non-stroke color because /'P504' is an invalid float value
2025-11-05 19:44:03,886 - pdfminer.pdfinterp - WARNING - Cannot set gray non-stroke color because /'P163' is an invalid float value
2025-11-05 19:44:03,886 - pdfminer.pdfinterp - WARNING - Cannot set gray non-stroke color because /'P194' is an invalid float value
2025-11-05 19:44:03,886 - pdfminer.pdfinterp - WARNING - Cannot set gray non-stroke color because /'P225' is an invalid float value
2025-11-05 19:44:03,886 - pdfminer.pdfinterp - WARNING - Cannot set gray non-stroke color because /'P256' is an invalid float value
2025-11-05 19:44:03,886 - pdfminer.pdfinterp - WARNING - Cannot set gray non-stroke color because /'P287' is an invalid float value
2025-11-05 19:44:03,886 - pdfminer.pdfinterp - WARNING - Cannot set gray non-stroke color because /'P318' is an invalid float value
2025-11-05 19:44:03,887 - pdfminer.pdfinterp - WARNING - Cannot set gray non-stroke color because /'P349' is an invalid float value
2025-11-05 19:44:03,887 - pdfminer.pdfinterp - WARNING - Cannot set gray non-stroke color because /'P380' is an invalid float value
2025-11-05 19:44:03,887 - pdfminer.pdfinterp - WARNING - Cannot set gray non-stroke color because /'P411' is an invalid float value
2025-11-05 19:44:03,887 - pdfminer.pdfinterp - WARNING - Cannot set gray non-stroke color because /'P442' is an invalid float value
2025-11-05 19:44:03,887 - pdfminer.pdfinterp - WARNING - Cannot set gray non-stroke color because /'P473' is an invalid float value
2025-11-05 19:44:03,887 - pdfminer.pdfinterp - WARNING - Cannot set gray non-stroke color because /'P504' is an invalid float value
2025-11-05 19:44:39,713 - am_structural_robust - INFO -   Processed 100/1660 pages
2025-11-05 19:45:31,361 - am_structural_robust - INFO -   Processed 150/1660 pages
2025-11-05 19:46:25,644 - am_structural_robust - INFO -   Processed 200/1660 pages
2025-11-05 19:46:38,034 - am_structural_robust - ERROR - [X] Page 210: All extractors failed
2025-11-05 19:46:48,602 - am_structural_robust - ERROR - [X] Page 219: All extractors failed
2025-11-05 19:46:51,768 - am_structural_robust - ERROR - [X] Page 221: All extractors failed
2025-11-05 19:46:53,925 - am_structural_robust - ERROR - [X] Page 222: All extractors failed
2025-11-05 19:47:11,321 - am_structural_robust - ERROR - [X] Page 237: All extractors failed
2025-11-05 19:47:14,487 - am_structural_robust - ERROR - [X] Page 239: All extractors failed
2025-11-05 19:47:17,720 - am_structural_robust - ERROR - [X] Page 241: All extractors failed
2025-11-05 19:47:26,582 - am_structural_robust - INFO -   Processed 250/1660 pages
2025-11-05 19:47:34,257 - pdfminer.pdfinterp - WARNING - Cannot set gray non-stroke color because /'P63' is an invalid float value
2025-11-05 19:47:34,258 - pdfminer.pdfinterp - WARNING - Cannot set gray non-stroke color because /'P69' is an invalid float value
2025-11-05 19:47:35,038 - pdfminer.pdfinterp - WARNING - Cannot set gray non-stroke color because /'P63' is an invalid float value
2025-11-05 19:47:35,039 - pdfminer.pdfinterp - WARNING - Cannot set gray non-stroke color because /'P69' is an invalid float value
2025-11-05 19:47:39,357 - pdfminer.pdfinterp - WARNING - Cannot set gray non-stroke color because /'P95' is an invalid float value
2025-11-05 19:47:39,358 - pdfminer.pdfinterp - WARNING - Cannot set gray non-stroke color because /'P97' is an invalid float value
2025-11-05 19:47:39,367 - pdfminer.pdfinterp - WARNING - Cannot set gray non-stroke color because /'P101' is an invalid float value
2025-11-05 19:47:40,360 - pdfminer.pdfinterp - WARNING - Cannot set gray non-stroke color because /'P95' is an invalid float value
2025-11-05 19:47:40,362 - pdfminer.pdfinterp - WARNING - Cannot set gray non-stroke color because /'P97' is an invalid float value
2025-11-05 19:47:40,372 - pdfminer.pdfinterp - WARNING - Cannot set gray non-stroke color because /'P101' is an invalid float value
2025-11-05 19:47:44,989 - pdfminer.pdfinterp - WARNING - Cannot set gray non-stroke color because /'P156' is an invalid float value
2025-11-05 19:47:45,971 - pdfminer.pdfinterp - WARNING - Cannot set gray non-stroke color because /'P156' is an invalid float value
2025-11-05 19:47:52,532 - pdfminer.pdfinterp - WARNING - Cannot set gray non-stroke color because /'P218' is an invalid float value
2025-11-05 19:47:52,532 - pdfminer.pdfinterp - WARNING - Cannot set gray non-stroke color because /'P219' is an invalid float value
2025-11-05 19:47:52,536 - pdfminer.pdfinterp - WARNING - Cannot set gray non-stroke color because /'P220' is an invalid float value
2025-11-05 19:47:53,636 - pdfminer.pdfinterp - WARNING - Cannot set gray non-stroke color because /'P218' is an invalid float value
2025-11-05 19:47:53,637 - pdfminer.pdfinterp - WARNING - Cannot set gray non-stroke color because /'P219' is an invalid float value
2025-11-05 19:47:53,642 - pdfminer.pdfinterp - WARNING - Cannot set gray non-stroke color because /'P220' is an invalid float value
2025-11-05 19:48:07,229 - pdfminer.pdfinterp - WARNING - Cannot set gray non-stroke color because /'P341' is an invalid float value
2025-11-05 19:48:07,233 - pdfminer.pdfinterp - WARNING - Cannot set gray non-stroke color because /'P352' is an invalid float value
2025-11-05 19:48:08,002 - pdfminer.pdfinterp - WARNING - Cannot set gray non-stroke color because /'P341' is an invalid float value
2025-11-05 19:48:08,007 - pdfminer.pdfinterp - WARNING - Cannot set gray non-stroke color because /'P352' is an invalid float value
2025-11-05 19:48:21,130 - am_structural_robust - INFO -   Processed 300/1660 pages
2025-11-05 19:48:24,224 - pdfminer.pdfinterp - WARNING - Cannot set gray non-stroke color because /'P56' is an invalid float value
2025-11-05 19:48:24,225 - pdfminer.pdfinterp - WARNING - Cannot set gray non-stroke color because /'P62' is an invalid float value
2025-11-05 19:48:24,979 - pdfminer.pdfinterp - WARNING - Cannot set gray non-stroke color because /'P56' is an invalid float value
2025-11-05 19:48:24,980 - pdfminer.pdfinterp - WARNING - Cannot set gray non-stroke color because /'P62' is an invalid float value
2025-11-05 19:48:30,469 - pdfminer.pdfinterp - WARNING - Cannot set gray non-stroke color because /'P99' is an invalid float value
2025-11-05 19:48:30,470 - pdfminer.pdfinterp - WARNING - Cannot set gray non-stroke color because /'P101' is an invalid float value
2025-11-05 19:48:30,477 - pdfminer.pdfinterp - WARNING - Cannot set gray non-stroke color because /'P109' is an invalid float value
2025-11-05 19:48:31,219 - pdfminer.pdfinterp - WARNING - Cannot set gray non-stroke color because /'P99' is an invalid float value
2025-11-05 19:48:31,220 - pdfminer.pdfinterp - WARNING - Cannot set gray non-stroke color because /'P101' is an invalid float value
2025-11-05 19:48:31,228 - pdfminer.pdfinterp - WARNING - Cannot set gray non-stroke color because /'P109' is an invalid float value
2025-11-05 19:48:32,608 - pdfminer.pdfinterp - WARNING - Cannot set gray non-stroke color because /'P117' is an invalid float value
2025-11-05 19:48:33,609 - pdfminer.pdfinterp - WARNING - Cannot set gray non-stroke color because /'P117' is an invalid float value
2025-11-05 19:48:40,944 - pdfminer.pdfinterp - WARNING - Cannot set gray non-stroke color because /'P174' is an invalid float value
2025-11-05 19:48:40,945 - pdfminer.pdfinterp - WARNING - Cannot set gray non-stroke color because /'P175' is an invalid float value
2025-11-05 19:48:40,948 - pdfminer.pdfinterp - WARNING - Cannot set gray non-stroke color because /'P176' is an invalid float value
2025-11-05 19:48:41,921 - pdfminer.pdfinterp - WARNING - Cannot set gray non-stroke color because /'P174' is an invalid float value
2025-11-05 19:48:41,921 - pdfminer.pdfinterp - WARNING - Cannot set gray non-stroke color because /'P175' is an invalid float value
2025-11-05 19:48:41,925 - pdfminer.pdfinterp - WARNING - Cannot set gray non-stroke color because /'P176' is an invalid float value
2025-11-05 19:49:09,909 - pdfminer.pdfinterp - WARNING - Cannot set gray non-stroke color because /'P72' is an invalid float value
2025-11-05 19:49:09,912 - pdfminer.pdfinterp - WARNING - Cannot set gray non-stroke color because /'P74' is an invalid float value
2025-11-05 19:49:10,648 - pdfminer.pdfinterp - WARNING - Cannot set gray non-stroke color because /'P72' is an invalid float value
2025-11-05 19:49:10,651 - pdfminer.pdfinterp - WARNING - Cannot set gray non-stroke color because /'P74' is an invalid float value
2025-11-05 19:49:14,023 - am_structural_robust - INFO -   Processed 350/1660 pages
2025-11-05 19:50:08,634 - am_structural_robust - INFO -   Processed 400/1660 pages
2025-11-05 19:51:04,186 - am_structural_robust - INFO -   Processed 450/1660 pages
2025-11-05 19:51:15,279 - am_structural_robust - ERROR - [X] Page 458: All extractors failed
2025-11-05 19:51:17,326 - am_structural_robust - ERROR - [X] Page 459: All extractors failed
2025-11-05 19:51:19,496 - am_structural_robust - ERROR - [X] Page 460: All extractors failed
2025-11-05 19:51:21,709 - am_structural_robust - ERROR - [X] Page 461: All extractors failed
2025-11-05 19:52:04,133 - am_structural_robust - INFO -   Processed 500/1660 pages
2025-11-05 19:52:57,465 - am_structural_robust - INFO -   Processed 550/1660 pages
2025-11-05 19:53:53,683 - am_structural_robust - INFO -   Processed 600/1660 pages
2025-11-05 19:54:48,412 - am_structural_robust - INFO -   Processed 650/1660 pages
2025-11-05 19:55:43,935 - am_structural_robust - INFO -   Processed 700/1660 pages
2025-11-05 19:56:32,480 - am_structural_robust - ERROR - [X] Page 743: All extractors failed
2025-11-05 19:56:39,758 - am_structural_robust - INFO -   Processed 750/1660 pages
2025-11-05 19:57:19,360 - am_structural_robust - ERROR - [X] Page 785: All extractors failed
2025-11-05 19:57:35,122 - am_structural_robust - INFO -   Processed 800/1660 pages
2025-11-05 19:58:11,374 - am_structural_robust - ERROR - [X] Page 833: All extractors failed
2025-11-05 19:58:17,663 - am_structural_robust - ERROR - [X] Page 838: All extractors failed
2025-11-05 19:58:29,646 - am_structural_robust - INFO -   Processed 850/1660 pages
2025-11-05 19:59:25,988 - am_structural_robust - INFO -   Processed 900/1660 pages
2025-11-05 19:59:34,994 - am_structural_robust - ERROR - [X] Page 907: All extractors failed
2025-11-05 19:59:43,691 - am_structural_robust - ERROR - [X] Page 914: All extractors failed
2025-11-05 20:00:23,886 - am_structural_robust - INFO -   Processed 950/1660 pages
2025-11-05 20:00:34,614 - am_structural_robust - ERROR - [X] Page 958: All extractors failed
2025-11-05 20:00:44,701 - am_structural_robust - ERROR - [X] Page 966: All extractors failed
2025-11-05 20:01:22,681 - am_structural_robust - INFO -   Processed 1000/1660 pages
2025-11-05 20:02:17,886 - am_structural_robust - INFO -   Processed 1050/1660 pages
2025-11-05 20:02:47,697 - am_structural_robust - ERROR - [X] Page 1077: All extractors failed
2025-11-05 20:03:11,971 - am_structural_robust - INFO -   Processed 1100/1660 pages
2025-11-05 20:04:05,823 - am_structural_robust - INFO -   Processed 1150/1660 pages
2025-11-05 20:04:59,427 - am_structural_robust - INFO -   Processed 1200/1660 pages
2025-11-05 20:05:10,588 - am_structural_robust - ERROR - [X] Page 1209: All extractors failed
2025-11-05 20:05:23,104 - am_structural_robust - ERROR - [X] Page 1220: All extractors failed
2025-11-05 20:05:34,474 - am_structural_robust - ERROR - [X] Page 1230: All extractors failed
2025-11-05 20:05:54,860 - am_structural_robust - INFO -   Processed 1250/1660 pages
2025-11-05 20:06:10,640 - pdfminer.pdfinterp - WARNING - Cannot set gray non-stroke color because /'P70' is an invalid float value
2025-11-05 20:06:10,640 - pdfminer.pdfinterp - WARNING - Cannot set gray non-stroke color because /'P72' is an invalid float value
2025-11-05 20:06:10,648 - pdfminer.pdfinterp - WARNING - Cannot set gray non-stroke color because /'P73' is an invalid float value
2025-11-05 20:06:10,649 - pdfminer.pdfinterp - WARNING - Cannot set gray non-stroke color because /'P74' is an invalid float value
2025-11-05 20:06:10,680 - pdfminer.pdfinterp - WARNING - Cannot set gray non-stroke color because /'P82' is an invalid float value
2025-11-05 20:06:11,222 - pdfminer.pdfinterp - WARNING - Cannot set gray non-stroke color because /'P70' is an invalid float value
2025-11-05 20:06:11,222 - pdfminer.pdfinterp - WARNING - Cannot set gray non-stroke color because /'P72' is an invalid float value
2025-11-05 20:06:11,231 - pdfminer.pdfinterp - WARNING - Cannot set gray non-stroke color because /'P73' is an invalid float value
2025-11-05 20:06:11,232 - pdfminer.pdfinterp - WARNING - Cannot set gray non-stroke color because /'P74' is an invalid float value
2025-11-05 20:06:11,258 - pdfminer.pdfinterp - WARNING - Cannot set gray non-stroke color because /'P82' is an invalid float value
2025-11-05 20:06:11,917 - pdfminer.pdfinterp - WARNING - Cannot set gray non-stroke color because /'P85' is an invalid float value
2025-11-05 20:06:11,917 - pdfminer.pdfinterp - WARNING - Cannot set gray non-stroke color because /'P86' is an invalid float value
2025-11-05 20:06:11,919 - pdfminer.pdfinterp - WARNING - Cannot set gray non-stroke color because /'P87' is an invalid float value
2025-11-05 20:06:11,927 - pdfminer.pdfinterp - WARNING - Cannot set gray non-stroke color because /'P88' is an invalid float value
2025-11-05 20:06:12,450 - pdfminer.pdfinterp - WARNING - Cannot set gray non-stroke color because /'P85' is an invalid float value
2025-11-05 20:06:12,451 - pdfminer.pdfinterp - WARNING - Cannot set gray non-stroke color because /'P86' is an invalid float value
2025-11-05 20:06:12,453 - pdfminer.pdfinterp - WARNING - Cannot set gray non-stroke color because /'P87' is an invalid float value
2025-11-05 20:06:12,462 - pdfminer.pdfinterp - WARNING - Cannot set gray non-stroke color because /'P88' is an invalid float value
2025-11-05 20:06:47,508 - am_structural_robust - INFO -   Processed 1300/1660 pages
2025-11-05 20:07:40,232 - am_structural_robust - INFO -   Processed 1350/1660 pages
2025-11-05 20:07:42,888 - am_structural_robust - ERROR - [X] Page 1351: All extractors failed
2025-11-05 20:08:34,127 - am_structural_robust - INFO -   Processed 1400/1660 pages
2025-11-05 20:09:27,223 - am_structural_robust - INFO -   Processed 1450/1660 pages
2025-11-05 20:10:06,063 - am_structural_robust - ERROR - [X] Page 1483: All extractors failed
2025-11-05 20:10:19,188 - am_structural_robust - ERROR - [X] Page 1494: All extractors failed
2025-11-05 20:10:25,161 - am_structural_robust - INFO -   Processed 1500/1660 pages
2025-11-05 20:10:31,040 - am_structural_robust - ERROR - [X] Page 1504: All extractors failed
2025-11-05 20:11:08,374 - pdfminer.pdfinterp - WARNING - Cannot set gray non-stroke color because /'P70' is an invalid float value
2025-11-05 20:11:08,374 - pdfminer.pdfinterp - WARNING - Cannot set gray non-stroke color because /'P72' is an invalid float value
2025-11-05 20:11:08,385 - pdfminer.pdfinterp - WARNING - Cannot set gray non-stroke color because /'P73' is an invalid float value
2025-11-05 20:11:08,386 - pdfminer.pdfinterp - WARNING - Cannot set gray non-stroke color because /'P74' is an invalid float value
2025-11-05 20:11:08,413 - pdfminer.pdfinterp - WARNING - Cannot set gray non-stroke color because /'P82' is an invalid float value
2025-11-05 20:11:08,912 - pdfminer.pdfinterp - WARNING - Cannot set gray non-stroke color because /'P70' is an invalid float value
2025-11-05 20:11:08,912 - pdfminer.pdfinterp - WARNING - Cannot set gray non-stroke color because /'P72' is an invalid float value
2025-11-05 20:11:08,922 - pdfminer.pdfinterp - WARNING - Cannot set gray non-stroke color because /'P73' is an invalid float value
2025-11-05 20:11:08,922 - pdfminer.pdfinterp - WARNING - Cannot set gray non-stroke color because /'P74' is an invalid float value
2025-11-05 20:11:08,948 - pdfminer.pdfinterp - WARNING - Cannot set gray non-stroke color because /'P82' is an invalid float value
2025-11-05 20:11:09,643 - pdfminer.pdfinterp - WARNING - Cannot set gray non-stroke color because /'P85' is an invalid float value
2025-11-05 20:11:09,644 - pdfminer.pdfinterp - WARNING - Cannot set gray non-stroke color because /'P86' is an invalid float value
2025-11-05 20:11:09,646 - pdfminer.pdfinterp - WARNING - Cannot set gray non-stroke color because /'P87' is an invalid float value
2025-11-05 20:11:09,655 - pdfminer.pdfinterp - WARNING - Cannot set gray non-stroke color because /'P88' is an invalid float value
2025-11-05 20:11:10,149 - pdfminer.pdfinterp - WARNING - Cannot set gray non-stroke color because /'P85' is an invalid float value
2025-11-05 20:11:10,150 - pdfminer.pdfinterp - WARNING - Cannot set gray non-stroke color because /'P86' is an invalid float value
2025-11-05 20:11:10,152 - pdfminer.pdfinterp - WARNING - Cannot set gray non-stroke color because /'P87' is an invalid float value
2025-11-05 20:11:10,161 - pdfminer.pdfinterp - WARNING - Cannot set gray non-stroke color because /'P88' is an invalid float value
2025-11-05 20:11:20,308 - am_structural_robust - INFO -   Processed 1550/1660 pages
2025-11-05 20:12:17,055 - am_structural_robust - INFO -   Processed 1600/1660 pages
2025-11-05 20:12:19,529 - am_structural_robust - ERROR - [X] Page 1601: All extractors failed
2025-11-05 20:12:33,376 - am_structural_robust - ERROR - [X] Page 1613: All extractors failed
2025-11-05 20:13:15,042 - am_structural_robust - ERROR - [X] Page 1649: All extractors failed
2025-11-05 20:13:15,693 - am_structural_robust - INFO -   Processed 1650/1660 pages
2025-11-05 20:13:27,176 - am_structural_robust - INFO - Extraction complete: 1660 success, 0 failed
2025-11-05 20:13:27,176 - am_structural_robust - INFO -   Methods used: {'pdfminer': 1630}
2025-11-05 20:13:27,176 - am_structural_robust - INFO -   OCR used: 0 pages
2025-11-05 20:13:27,176 - am_structural_robust - INFO -   Tables found: 657
2025-11-05 20:13:27,203 - am_common - INFO - Saving dataset: c:\scripts\1repo\data\datasets\structural\ядро_2025-08-29.dataset.jsonl (1660 cards)
2025-11-05 20:13:27,245 - am_common - INFO - Saved: 1660 cards to ядро_2025-08-29.dataset.jsonl (5.13 MB)
2025-11-05 20:13:27,245 - am_structural_robust - INFO - Dataset saved: 5.13 MB
2025-11-05 20:13:27,246 - quality_tracker - INFO - Starting: track_quality
2025-11-05 20:13:27,247 - quality_tracker - INFO - structural metrics:
2025-11-05 20:13:27,247 - quality_tracker - INFO -   total_pages: 1660
2025-11-05 20:13:27,247 - quality_tracker - INFO -   success_pages: 1660
2025-11-05 20:13:27,247 - quality_tracker - INFO -   failed_pages: 0
2025-11-05 20:13:27,247 - quality_tracker - INFO -   success_ratio: 1.0000
2025-11-05 20:13:27,247 - quality_tracker - INFO -   empty_pages: 76
2025-11-05 20:13:27,247 - quality_tracker - INFO -   avg_page_length: 1104.7416
2025-11-05 20:13:27,247 - quality_tracker - INFO -   extraction_methods: {'pdfminer': 1630}
2025-11-05 20:13:27,247 - quality_tracker - INFO -   ocr_used: 0
2025-11-05 20:13:27,247 - quality_tracker - INFO -   tables_found: 657
2025-11-05 20:13:27,247 - quality_tracker - INFO - ✓ Quality thresholds passed for structural
2025-11-05 20:13:27,247 - quality_tracker - INFO - Completed: track_quality (0.00s)
2025-11-05 20:13:27,248 - am_structural_robust - INFO - [OK] Saved: ядро_2025-08-29.dataset.jsonl
2025-11-05 20:13:27,250 - validate - INFO - Validating structural: ядро_2025-08-29.dataset.jsonl
2025-11-05 20:13:27,250 - am_common - INFO - Loading dataset: c:\scripts\1repo\data\datasets\structural\ядро_2025-08-29.dataset.jsonl
2025-11-05 20:13:27,298 - am_common - WARNING - Failed to parse line 588: {"segment_id": "00587", "page_num": 587, "segment"... Error: Unterminated string starting at: line 1 column 53 (char 52)
2025-11-05 20:13:27,298 - am_common - WARNING - Failed to parse line 589: в комментариях\n<важно>Задачи типа КСМ в статусе “... Error: Expecting value: line 1 column 1 (char 0)
2025-11-05 20:13:27,310 - am_common - INFO - Loaded: 1659 cards from ядро_2025-08-29.dataset.jsonl
2025-11-05 20:13:27,316 - validate - INFO - [OK] VALID - ядро_2025-08-29.dataset.jsonl
2025-11-05 20:13:27,316 - __main__ - INFO - ============================================================
2025-11-05 20:13:27,316 - __main__ - INFO -   📄 Completed: STRUCTURAL
2025-11-05 20:13:27,316 - __main__ - INFO - ============================================================
2025-11-05 20:13:27,316 - __main__ - INFO - ============================================================
2025-11-05 20:13:27,316 - __main__ - INFO -   📖 Starting: STRUCTURE_DETECT
2025-11-05 20:13:27,316 - __main__ - INFO - ============================================================
2025-11-05 20:13:27,316 - am_common - INFO - Loading config: config\batch_full.yaml
2025-11-05 20:13:27,333 - am_common - INFO - Config loaded successfully
2025-11-05 20:13:27,334 - am_structure_detect - INFO - Processing: ядро_2025-08-29.dataset.jsonl
2025-11-05 20:13:27,334 - am_common - INFO - Loading dataset: c:\scripts\1repo\data\datasets\structural\ядро_2025-08-29.dataset.jsonl
2025-11-05 20:13:27,592 - am_common - WARNING - Failed to parse line 588: {"segment_id": "00587", "page_num": 587, "segment"... Error: Unterminated string starting at: line 1 column 53 (char 52)
2025-11-05 20:13:27,592 - am_common - WARNING - Failed to parse line 589: в комментариях\n<важно>Задачи типа КСМ в статусе “... Error: Expecting value: line 1 column 1 (char 0)
2025-11-05 20:13:27,602 - am_common - INFO - Loaded: 1659 cards from ядро_2025-08-29.dataset.jsonl
2025-11-05 20:13:27,610 - am_structure_detect - INFO - Detected 0 chapters
2025-11-05 20:13:27,616 - am_structure_detect - INFO - Detected 59 sections
2025-11-05 20:13:27,617 - am_common - INFO - Saving dataset: c:\scripts\1repo\data\datasets\structured\ядро_2025-08-29.dataset.jsonl (1659 cards)
2025-11-05 20:13:27,659 - am_common - INFO - Saved: 1659 cards to ядро_2025-08-29.dataset.jsonl (5.44 MB)
2025-11-05 20:13:27,660 - quality_tracker - INFO - Starting: track_quality
2025-11-05 20:13:27,660 - quality_tracker - INFO - structure_detect metrics:
2025-11-05 20:13:27,661 - quality_tracker - INFO -   total_pages: 1659
2025-11-05 20:13:27,661 - quality_tracker - INFO -   chapters_detected: 0
2025-11-05 20:13:27,661 - quality_tracker - INFO -   sections_detected: 59
2025-11-05 20:13:27,661 - quality_tracker - INFO -   pages_with_structure: 1635
2025-11-05 20:13:27,661 - quality_tracker - INFO -   structure_coverage: 0.9855
2025-11-05 20:13:27,661 - quality_tracker - INFO -   avg_chapter_length: 0
2025-11-05 20:13:27,661 - quality_tracker - INFO - ✓ Quality thresholds passed for structure_detect
2025-11-05 20:13:27,661 - quality_tracker - INFO - Completed: track_quality (0.00s)
2025-11-05 20:13:27,661 - am_structure_detect - INFO - Saved: ядро_2025-08-29.dataset.jsonl
2025-11-05 20:13:27,664 - __main__ - ERROR - Validation failed: Unknown stage: structure_detect
2025-11-05 20:13:27,664 - __main__ - WARNING - Validation issues: 1 errors
2025-11-05 20:13:27,664 - __main__ - INFO - ============================================================
2025-11-05 20:13:27,664 - __main__ - INFO -   📖 Completed: STRUCTURE_DETECT
2025-11-05 20:13:27,664 - __main__ - INFO - ============================================================
2025-11-05 20:13:27,664 - __main__ - INFO - ============================================================
2025-11-05 20:13:27,664 - __main__ - INFO -   📝 Starting: SUMMARIZE
2025-11-05 20:13:27,664 - __main__ - INFO - ============================================================
2025-11-05 20:13:27,664 - am_common - INFO - Loading config: config\batch_full.yaml
2025-11-05 20:13:27,679 - am_common - INFO - Config loaded successfully
2025-11-05 20:13:27,680 - am_summarize - INFO - Processing: ядро_2025-08-29.dataset.jsonl
2025-11-05 20:13:27,680 - am_common - INFO - Loading dataset: c:\scripts\1repo\data\datasets\structured\ядро_2025-08-29.dataset.jsonl
2025-11-05 20:13:27,738 - am_common - INFO - Loaded: 1659 cards from ядро_2025-08-29.dataset.jsonl
2025-11-05 20:13:28,394 - am_summarize - INFO - Summarized 1583 pages, skipped 76
2025-11-05 20:13:28,395 - am_common - INFO - Saving dataset: c:\scripts\1repo\data\datasets\summarized\ядро_2025-08-29.dataset.jsonl (1659 cards)
2025-11-05 20:13:28,448 - am_common - INFO - Saved: 1659 cards to ядро_2025-08-29.dataset.jsonl (6.99 MB)
2025-11-05 20:13:28,450 - quality_tracker - INFO - Starting: track_quality
2025-11-05 20:13:28,450 - quality_tracker - INFO - summarize metrics:
2025-11-05 20:13:28,450 - quality_tracker - INFO -   total_pages: 1659
2025-11-05 20:13:28,450 - quality_tracker - INFO -   summarized_pages: 1583
2025-11-05 20:13:28,450 - quality_tracker - INFO -   skipped_pages: 76
2025-11-05 20:13:28,451 - quality_tracker - INFO -   summary_coverage: 0.9542
2025-11-05 20:13:28,451 - quality_tracker - INFO -   avg_l1_length: 175.1713
2025-11-05 20:13:28,451 - quality_tracker - INFO -   avg_l2_length: 386.8072
2025-11-05 20:13:28,451 - quality_tracker - INFO -   avg_compression_ratio: 7.3400
2025-11-05 20:13:28,451 - quality_tracker - INFO - ✓ Quality thresholds passed for summarize
2025-11-05 20:13:28,451 - quality_tracker - INFO - Completed: track_quality (0.00s)
2025-11-05 20:13:28,451 - am_summarize - INFO - Saved: ядро_2025-08-29.dataset.jsonl
2025-11-05 20:13:28,453 - __main__ - ERROR - Validation failed: Unknown stage: summarize
2025-11-05 20:13:28,453 - __main__ - WARNING - Validation issues: 1 errors
2025-11-05 20:13:28,453 - __main__ - INFO - ============================================================
2025-11-05 20:13:28,453 - __main__ - INFO -   📝 Completed: SUMMARIZE
2025-11-05 20:13:28,453 - __main__ - INFO - ============================================================
2025-11-05 20:13:28,453 - __main__ - INFO - ============================================================
2025-11-05 20:13:28,453 - __main__ - INFO -   🤖 Starting: EXTENDED
2025-11-05 20:13:28,453 - __main__ - INFO - ============================================================
2025-11-05 20:13:28,453 - am_common - INFO - Loading config: config\batch_full.yaml
2025-11-05 20:13:28,468 - am_common - INFO - Config loaded successfully
2025-11-05 20:13:28,489 - am_extended - INFO - [LM EXTRACTION] Model 'qwen2.5:7b' confirmed available
2025-11-05 20:13:28,490 - am_extended - INFO - [LM EXTRACTION] Ollama available, using model: qwen2.5:7b
2025-11-05 20:13:28,490 - am_extended - INFO - Processing: ядро_2025-08-29.dataset.jsonl
2025-11-05 20:13:28,490 - am_common - INFO - Loading dataset: c:\scripts\1repo\data\datasets\summarized\ядро_2025-08-29.dataset.jsonl
2025-11-05 20:13:28,559 - am_common - INFO - Loaded: 1659 cards from ядро_2025-08-29.dataset.jsonl
2025-11-05 20:13:28,592 - am_extended - INFO - Marked 364 duplicate pages
2025-11-05 20:13:28,673 - am_extended - INFO - Found 690 continuity gaps
2025-11-05 20:13:28,673 - am_extended - INFO - Extracting extended fields (this may take a while)...
2025-11-05 20:13:56,883 - am_extended - INFO -   Processed 10/1659 pages
2025-11-05 20:14:18,377 - am_extended - INFO -   Processed 20/1659 pages
2025-11-05 20:14:40,458 - am_extended - INFO -   Processed 30/1659 pages
2025-11-05 20:15:08,104 - am_extended - INFO -   Processed 40/1659 pages
2025-11-05 20:15:52,569 - am_extended - INFO -   Processed 60/1659 pages
2025-11-05 20:16:15,931 - am_extended - INFO -   Processed 70/1659 pages
2025-11-05 20:16:38,966 - am_extended - INFO -   Processed 80/1659 pages
2025-11-05 20:17:04,869 - am_extended - INFO -   Processed 90/1659 pages
2025-11-05 20:17:36,793 - am_extended - INFO -   Processed 100/1659 pages
2025-11-05 20:18:01,969 - am_extended - INFO -   Processed 110/1659 pages
2025-11-05 20:18:25,814 - am_extended - INFO -   Processed 120/1659 pages
2025-11-05 20:18:52,212 - am_extended - INFO -   Processed 130/1659 pages
2025-11-05 20:19:21,681 - am_extended - INFO -   Processed 140/1659 pages
2025-11-05 20:19:47,779 - am_extended - INFO -   Processed 150/1659 pages
2025-11-05 20:20:15,780 - am_extended - INFO -   Processed 160/1659 pages
2025-11-05 20:20:41,240 - am_extended - INFO -   Processed 170/1659 pages
2025-11-05 20:21:08,174 - am_extended - INFO -   Processed 180/1659 pages
2025-11-05 20:21:33,336 - am_extended - INFO -   Processed 190/1659 pages
2025-11-05 20:21:57,702 - am_extended - INFO -   Processed 200/1659 pages
2025-11-05 20:22:18,704 - am_extended - INFO -   Processed 210/1659 pages
2025-11-05 20:22:55,668 - am_extended - INFO -   Processed 230/1659 pages
2025-11-05 20:23:38,828 - am_extended - INFO -   Processed 250/1659 pages
2025-11-05 20:24:23,115 - am_extended - INFO -   Processed 270/1659 pages
2025-11-05 20:24:46,177 - am_extended - INFO -   Processed 280/1659 pages
2025-11-05 20:25:12,170 - am_extended - INFO -   Processed 290/1659 pages
2025-11-05 20:25:54,905 - am_extended - INFO -   Processed 310/1659 pages
2025-11-05 20:26:16,725 - am_extended - INFO -   Processed 320/1659 pages
2025-11-05 20:26:41,605 - am_extended - INFO -   Processed 330/1659 pages
2025-11-05 20:27:24,103 - am_extended - INFO -   Processed 350/1659 pages
2025-11-05 20:27:47,887 - am_extended - INFO -   Processed 360/1659 pages
2025-11-05 20:28:12,832 - am_extended - INFO -   Processed 370/1659 pages
2025-11-05 20:28:38,354 - am_extended - INFO -   Processed 380/1659 pages
2025-11-05 20:29:05,633 - am_extended - INFO -   Processed 390/1659 pages
2025-11-05 20:29:32,512 - am_extended - INFO -   Processed 400/1659 pages
2025-11-05 20:29:53,660 - am_extended - INFO -   Processed 410/1659 pages
2025-11-05 20:30:08,760 - am_extended - INFO -   Processed 420/1659 pages
2025-11-05 20:30:32,407 - am_extended - INFO -   Processed 430/1659 pages
2025-11-05 20:31:01,756 - am_extended - INFO -   Processed 440/1659 pages
2025-11-05 20:31:26,407 - am_extended - INFO -   Processed 450/1659 pages
2025-11-05 20:32:08,513 - am_extended - INFO -   Processed 470/1659 pages
2025-11-05 20:32:34,400 - am_extended - INFO -   Processed 480/1659 pages
2025-11-05 20:33:00,898 - am_extended - INFO -   Processed 490/1659 pages
2025-11-05 20:33:28,056 - am_extended - INFO -   Processed 500/1659 pages
2025-11-05 20:33:53,337 - am_extended - INFO -   Processed 510/1659 pages
2025-11-05 20:34:17,833 - am_extended - INFO -   Processed 520/1659 pages
2025-11-05 20:34:44,203 - am_extended - INFO -   Processed 530/1659 pages
2025-11-05 20:35:08,873 - am_extended - INFO -   Processed 540/1659 pages
2025-11-05 20:35:34,313 - am_extended - INFO -   Processed 550/1659 pages
2025-11-05 20:35:59,162 - am_extended - INFO -   Processed 560/1659 pages
2025-11-05 20:36:30,007 - am_extended - INFO -   Processed 570/1659 pages
2025-11-05 20:37:01,481 - am_extended - INFO -   Processed 580/1659 pages
2025-11-05 20:37:29,701 - am_extended - INFO -   Processed 590/1659 pages
2025-11-05 20:38:01,576 - am_extended - INFO -   Processed 600/1659 pages
2025-11-05 20:38:33,063 - am_extended - INFO -   Processed 610/1659 pages
2025-11-05 20:39:00,063 - am_extended - INFO -   Processed 620/1659 pages
2025-11-05 20:39:27,614 - am_extended - INFO -   Processed 630/1659 pages
2025-11-05 20:39:55,181 - am_extended - INFO -   Processed 640/1659 pages
2025-11-05 20:40:25,011 - am_extended - INFO -   Processed 650/1659 pages
2025-11-05 20:40:52,529 - am_extended - INFO -   Processed 660/1659 pages
2025-11-05 20:41:21,426 - am_extended - INFO -   Processed 670/1659 pages
2025-11-05 20:41:51,991 - am_extended - INFO -   Processed 680/1659 pages
2025-11-05 20:42:19,487 - am_extended - INFO -   Processed 690/1659 pages
2025-11-05 20:42:44,893 - am_extended - INFO -   Processed 700/1659 pages
2025-11-05 20:43:12,235 - am_extended - INFO -   Processed 710/1659 pages
2025-11-05 20:43:41,629 - am_extended - INFO -   Processed 720/1659 pages
2025-11-05 20:44:12,299 - am_extended - INFO -   Processed 730/1659 pages
2025-11-05 20:44:42,193 - am_extended - INFO -   Processed 740/1659 pages
2025-11-05 20:45:33,516 - am_extended - INFO -   Processed 760/1659 pages
2025-11-05 20:46:00,280 - am_extended - INFO -   Processed 770/1659 pages
2025-11-05 20:46:33,399 - am_extended - INFO -   Processed 790/1659 pages
2025-11-05 20:46:57,534 - am_extended - INFO -   Processed 800/1659 pages
2025-11-05 20:47:21,061 - am_extended - INFO -   Processed 810/1659 pages
2025-11-05 20:47:46,920 - am_extended - INFO -   Processed 820/1659 pages
2025-11-05 20:48:09,046 - am_extended - INFO -   Processed 830/1659 pages
2025-11-05 20:48:41,911 - am_extended - INFO -   Processed 850/1659 pages
2025-11-05 20:49:06,757 - am_extended - INFO -   Processed 860/1659 pages
2025-11-05 20:49:26,320 - am_extended - INFO -   Processed 870/1659 pages
2025-11-05 20:49:48,891 - am_extended - INFO -   Processed 880/1659 pages
2025-11-05 20:50:14,088 - am_extended - INFO -   Processed 890/1659 pages
2025-11-05 20:50:41,530 - am_extended - INFO -   Processed 900/1659 pages
2025-11-05 20:51:02,822 - am_extended - INFO -   Processed 910/1659 pages
2025-11-05 20:51:22,488 - am_extended - INFO -   Processed 920/1659 pages
2025-11-05 20:51:50,016 - am_extended - INFO -   Processed 930/1659 pages
2025-11-05 20:52:16,956 - am_extended - INFO -   Processed 940/1659 pages
2025-11-05 20:52:42,477 - am_extended - INFO -   Processed 950/1659 pages
2025-11-05 20:53:01,995 - am_extended - INFO -   Processed 960/1659 pages
2025-11-05 20:53:20,782 - am_extended - INFO -   Processed 970/1659 pages
2025-11-05 20:53:43,798 - am_extended - INFO -   Processed 980/1659 pages
2025-11-05 20:54:05,867 - am_extended - INFO -   Processed 990/1659 pages
2025-11-05 20:54:31,143 - am_extended - INFO -   Processed 1000/1659 pages
2025-11-05 20:54:53,605 - am_extended - INFO -   Processed 1010/1659 pages
2025-11-05 20:55:19,031 - am_extended - INFO -   Processed 1020/1659 pages
2025-11-05 20:55:46,119 - am_extended - INFO -   Processed 1030/1659 pages
2025-11-05 20:56:09,994 - am_extended - INFO -   Processed 1040/1659 pages
2025-11-05 20:56:35,892 - am_extended - INFO -   Processed 1050/1659 pages
2025-11-05 20:57:00,666 - am_extended - INFO -   Processed 1060/1659 pages
2025-11-05 20:57:25,837 - am_extended - INFO -   Processed 1070/1659 pages
2025-11-05 20:57:49,592 - am_extended - INFO -   Processed 1080/1659 pages
2025-11-05 20:58:16,276 - am_extended - INFO -   Processed 1090/1659 pages
2025-11-05 20:58:41,558 - am_extended - INFO -   Processed 1100/1659 pages
2025-11-05 20:59:08,328 - am_extended - INFO -   Processed 1110/1659 pages
2025-11-05 20:59:34,059 - am_extended - INFO -   Processed 1120/1659 pages
2025-11-05 20:59:59,514 - am_extended - INFO -   Processed 1130/1659 pages
2025-11-05 21:00:24,665 - am_extended - INFO -   Processed 1140/1659 pages
2025-11-05 21:00:48,715 - am_extended - INFO -   Processed 1150/1659 pages
2025-11-05 21:01:15,563 - am_extended - INFO -   Processed 1160/1659 pages
2025-11-05 21:01:45,648 - am_extended - INFO -   Processed 1170/1659 pages
2025-11-05 21:02:11,269 - am_extended - INFO -   Processed 1180/1659 pages
2025-11-05 21:02:40,022 - am_extended - INFO -   Processed 1190/1659 pages
2025-11-05 21:03:07,594 - am_extended - INFO -   Processed 1200/1659 pages
2025-11-05 21:03:27,861 - am_extended - INFO -   Processed 1210/1659 pages
2025-11-05 21:04:36,724 - am_extended - INFO -   Processed 1240/1659 pages
2025-11-05 21:04:58,541 - am_extended - INFO -   Processed 1250/1659 pages
2025-11-05 21:05:19,263 - am_extended - INFO -   Processed 1260/1659 pages
2025-11-05 21:05:42,701 - am_extended - INFO -   Processed 1270/1659 pages
2025-11-05 21:06:11,878 - am_extended - INFO -   Processed 1550/1659 pages
2025-11-05 21:06:29,256 - am_extended - INFO -   Processed 1650/1659 pages
2025-11-05 21:06:39,331 - am_extended - INFO - Extracted extended fields for 1194 pages
2025-11-05 21:06:39,331 - am_common - INFO - Saving dataset: c:\scripts\1repo\data\datasets\extended\ядро_2025-08-29.dataset.jsonl (1659 cards)
2025-11-05 21:06:39,402 - am_common - INFO - Saved: 1659 cards to ядро_2025-08-29.dataset.jsonl (8.57 MB)
2025-11-05 21:06:39,403 - quality_tracker - INFO - Starting: track_quality
2025-11-05 21:06:39,404 - quality_tracker - INFO - extended metrics:
2025-11-05 21:06:39,404 - quality_tracker - INFO -   total_cards: 1659
2025-11-05 21:06:39,404 - quality_tracker - INFO -   duplicates_found: 364
2025-11-05 21:06:39,404 - quality_tracker - INFO -   duplicate_ratio: 0.2194
2025-11-05 21:06:39,404 - quality_tracker - INFO -   continuity_gaps: 690
2025-11-05 21:06:39,404 - quality_tracker - INFO -   continuity_gap_ratio: 0.4162
2025-11-05 21:06:39,404 - quality_tracker - INFO -   avg_overlap: 0.1170
2025-11-05 21:06:39,404 - quality_tracker - INFO -   extended_fields_extracted: 1194
2025-11-05 21:06:39,404 - quality_tracker - INFO -   extraction_coverage: 0.7197
2025-11-05 21:06:39,404 - quality_tracker - INFO -   lm_extraction_count: 1194
2025-11-05 21:06:39,404 - quality_tracker - INFO -   lm_extraction_ratio: 1.0000
2025-11-05 21:06:39,404 - quality_tracker - INFO - ✓ Quality thresholds passed for extended
2025-11-05 21:06:39,404 - quality_tracker - INFO - Completed: track_quality (0.00s)
2025-11-05 21:06:39,404 - am_extended - INFO - Saved: ядро_2025-08-29.dataset.jsonl
2025-11-05 21:06:39,410 - validate - INFO - Validating extended: ядро_2025-08-29.dataset.jsonl
2025-11-05 21:06:39,410 - am_common - INFO - Loading dataset: c:\scripts\1repo\data\datasets\extended\ядро_2025-08-29.dataset.jsonl
2025-11-05 21:06:39,493 - am_common - INFO - Loaded: 1659 cards from ядро_2025-08-29.dataset.jsonl
2025-11-05 21:06:39,499 - validate - WARNING - [X] INVALID - ядро_2025-08-29.dataset.jsonl (2 errors)
2025-11-05 21:06:39,499 - __main__ - WARNING - Validation issues: 2 errors, 0 warnings
2025-11-05 21:06:39,499 - __main__ - WARNING - Validation issues: 2 errors
2025-11-05 21:06:39,499 - __main__ - INFO - ============================================================
2025-11-05 21:06:39,499 - __main__ - INFO -   🤖 Completed: EXTENDED
2025-11-05 21:06:39,499 - __main__ - INFO - ============================================================
2025-11-05 21:06:39,499 - __main__ - INFO - ============================================================
2025-11-05 21:06:39,499 - __main__ - INFO -   ✅ Starting: FINALIZE
2025-11-05 21:06:39,499 - __main__ - INFO - ============================================================
2025-11-05 21:06:39,499 - am_common - INFO - Loading config: config\batch_full.yaml
2025-11-05 21:06:39,514 - am_common - INFO - Config loaded successfully
2025-11-05 21:06:39,514 - am_finalize - INFO - Processing: ядро_2025-08-29.dataset.jsonl
2025-11-05 21:06:39,514 - am_common - INFO - Loading dataset: c:\scripts\1repo\data\datasets\extended\ядро_2025-08-29.dataset.jsonl
2025-11-05 21:06:39,588 - am_common - INFO - Loaded: 1659 cards from ядро_2025-08-29.dataset.jsonl
2025-11-05 21:06:39,595 - am_common - INFO - Saving dataset: c:\scripts\1repo\data\datasets\final\ядро_2025-08-29.dataset.jsonl (1659 cards)
2025-11-05 21:06:39,662 - am_common - INFO - Saved: 1659 cards to ядро_2025-08-29.dataset.jsonl (8.46 MB)
2025-11-05 21:06:39,665 - quality_tracker - INFO - Starting: track_quality
2025-11-05 21:06:39,666 - quality_tracker - INFO - finalize metrics:
2025-11-05 21:06:39,666 - quality_tracker - INFO -   total_cards: 1659
2025-11-05 21:06:39,666 - quality_tracker - INFO -   validation_errors: 0
2025-11-05 21:06:39,666 - quality_tracker - INFO -   validation_warnings: 214
2025-11-05 21:06:39,666 - quality_tracker - INFO -   avg_completeness: 0.6190
2025-11-05 21:06:39,666 - quality_tracker - INFO -   cards_with_structure: 1635
2025-11-05 21:06:39,666 - quality_tracker - INFO -   structure_coverage: 0.9855
2025-11-05 21:06:39,666 - quality_tracker - INFO -   cards_with_summaries: 1582
2025-11-05 21:06:39,666 - quality_tracker - INFO -   summary_coverage: 0.9536
2025-11-05 21:06:39,666 - quality_tracker - INFO - ✓ Quality thresholds passed for finalize
2025-11-05 21:06:39,666 - quality_tracker - INFO - Completed: track_quality (0.00s)
2025-11-05 21:06:39,666 - am_finalize - INFO - Saved: ядро_2025-08-29.dataset.jsonl
2025-11-05 21:06:39,671 - __main__ - ERROR - Validation failed: Unknown stage: finalize
2025-11-05 21:06:39,671 - __main__ - WARNING - Validation issues: 1 errors
2025-11-05 21:06:39,671 - __main__ - INFO - ============================================================
2025-11-05 21:06:39,671 - __main__ - INFO -   ✅ Completed: FINALIZE
2025-11-05 21:06:39,671 - __main__ - INFO - ============================================================
2025-11-05 21:06:39,671 - __main__ - INFO - ============================================================
2025-11-05 21:06:39,671 - __main__ - INFO -   🧩 Starting: CHUNK
2025-11-05 21:06:39,671 - __main__ - INFO - ============================================================
2025-11-05 21:06:39,671 - am_common - INFO - Loading config: config\batch_full.yaml
2025-11-05 21:06:39,686 - am_common - INFO - Config loaded successfully
2025-11-05 21:06:39,771 - am_chunk - INFO - Processing: ядро_2025-08-29.dataset.jsonl
2025-11-05 21:06:39,772 - am_common - INFO - Loading dataset: c:\scripts\1repo\data\datasets\final\ядро_2025-08-29.dataset.jsonl
2025-11-05 21:06:39,853 - am_common - INFO - Loaded: 1659 cards from ядро_2025-08-29.dataset.jsonl
2025-11-05 21:06:40,609 - am_chunk - INFO - Created 2329 chunks from 1659 pages
2025-11-05 21:06:40,667 - quality_tracker - INFO - Starting: track_quality
2025-11-05 21:06:40,668 - quality_tracker - INFO - chunk metrics:
2025-11-05 21:06:40,668 - quality_tracker - INFO -   total_chunks: 2329
2025-11-05 21:06:40,668 - quality_tracker - INFO -   chunks_per_page: 1.4039
2025-11-05 21:06:40,668 - quality_tracker - INFO -   avg_chunk_tokens: 369.9055
2025-11-05 21:06:40,668 - quality_tracker - INFO -   min_chunk_tokens: 100
2025-11-05 21:06:40,668 - quality_tracker - INFO -   max_chunk_tokens: 1552
2025-11-05 21:06:40,668 - quality_tracker - INFO -   token_distribution: {'0-100': 0, '100-300': 750, '300-512': 1463, '512+': 116}
2025-11-05 21:06:40,668 - quality_tracker - INFO -   context_completeness: 1.0000
2025-11-05 21:06:40,668 - quality_tracker - INFO - ✓ Quality thresholds passed for chunk
2025-11-05 21:06:40,668 - quality_tracker - INFO - Completed: track_quality (0.00s)
2025-11-05 21:06:40,668 - am_chunk - INFO - Saved: ядро_2025-08-29.dataset.chunks.jsonl
2025-11-05 21:06:40,674 - __main__ - ERROR - Validation failed: Unknown stage: chunk
2025-11-05 21:06:40,674 - __main__ - WARNING - Validation issues: 1 errors
2025-11-05 21:06:40,674 - __main__ - INFO - ============================================================
2025-11-05 21:06:40,674 - __main__ - INFO -   🧩 Completed: CHUNK
2025-11-05 21:06:40,674 - __main__ - INFO - ============================================================
2025-11-05 21:06:40,674 - __main__ - INFO - ============================================================
2025-11-05 21:06:40,675 - __main__ - INFO -   🔢 Starting: EMBED
2025-11-05 21:06:40,675 - __main__ - INFO - ============================================================
2025-11-05 21:06:40,675 - am_common - INFO - Loading config: config\batch_full.yaml
2025-11-05 21:06:40,689 - am_common - INFO - Config loaded successfully
2025-11-05 21:06:40,689 - am_embed - INFO - [sentence-transformers] Loading model: all-MiniLM-L6-v2
2025-11-05 21:06:40,697 - sentence_transformers.SentenceTransformer - INFO - Use pytorch device_name: cpu
2025-11-05 21:06:40,697 - sentence_transformers.SentenceTransformer - INFO - Load pretrained SentenceTransformer: all-MiniLM-L6-v2
2025-11-05 21:06:55,834 - am_embed - INFO - [sentence-transformers] Embedding dimension: 384
2025-11-05 21:06:55,834 - am_embed - INFO - Processing: ядро_2025-08-29.dataset.chunks.jsonl
2025-11-05 21:06:55,883 - am_embed - INFO - Loaded 2329 chunks
2025-11-05 21:06:55,884 - am_embed - INFO - Encoding 2329 chunks in 73 batches
2025-11-05 21:06:59,191 - am_embed - INFO - Processed batch 10/73
2025-11-05 21:07:02,394 - am_embed - INFO - Processed batch 20/73
2025-11-05 21:07:05,575 - am_embed - INFO - Processed batch 30/73
2025-11-05 21:07:08,701 - am_embed - INFO - Processed batch 40/73
2025-11-05 21:07:11,865 - am_embed - INFO - Processed batch 50/73
2025-11-05 21:07:14,997 - am_embed - INFO - Processed batch 60/73
2025-11-05 21:07:18,097 - am_embed - INFO - Processed batch 70/73
2025-11-05 21:07:18,970 - am_embed - INFO - Encoded 2329 embeddings, 0 failures
2025-11-05 21:07:18,970 - am_embed - INFO - Building FAISS index: flat, metric=cosine
2025-11-05 21:07:18,970 - am_embed - INFO - Vectors: 2329, Dimension: 384
2025-11-05 21:07:18,971 - am_embed - INFO - FAISS index built: 2329 vectors
2025-11-05 21:07:18,973 - __main__ - ERROR - Stage failed: [WinError 2] Не удается найти указанный файл: 'c:\\scripts\\1repo\\data\\indexes\\faiss\\ядро_2025-08-29.dataset.faiss'
2025-11-05 21:07:18,973 - __main__ - ERROR - Error details:
Traceback (most recent call last):
  File "c:\scripts\1repo\run_mvp.py", line 255, in run_single
    stage_result = self._run_stage(stage, current_input)
  File "c:\scripts\1repo\run_mvp.py", line 457, in _run_stage
    return processor.process_chunks(input_path, output_dir=None)
           ~~~~~~~~~~~~~~~~~~~~~~~~^^^^^^^^^^^^^^^^^^^^^^^^^^^^^
  File "c:\scripts\1repo\am_embed.py", line 413, in process_chunks
    self.index_builder.save_index(index, index_path)
    ~~~~~~~~~~~~~~~~~~~~~~~~~~~~~^^^^^^^^^^^^^^^^^^^
  File "c:\scripts\1repo\am_embed.py", line 331, in save_index
    index_size = path.stat().st_size
                 ~~~~~~~~~^^
  File "C:\Users\Dimon\AppData\Local\Programs\Python\Python313\Lib\pathlib\_local.py", line 515, in stat
    return os.stat(self, follow_symlinks=follow_symlinks)
           ~~~~~~~^^^^^^^^^^^^^^^^^^^^^^^^^^^^^^^^^^^^^^^
FileNotFoundError: [WinError 2] Не удается найти указанный файл: 'c:\\scripts\\1repo\\data\\indexes\\faiss\\ядро_2025-08-29.dataset.faiss'
2025-11-05 21:07:18,975 - __main__ - WARNING - Non-critical stage failed, attempting to continue
2025-11-05 21:07:18,978 - __main__ - INFO - Pipeline status: partial
2025-11-05 21:07:18,978 - __main__ - INFO - Completed: run_single_pipeline (5062.33s)
2025-11-05 21:07:18,978 - __main__ - INFO - ============================================================
2025-11-05 21:07:18,978 - __main__ - INFO -   📊 FINAL REPORTS
2025-11-05 21:07:18,978 - __main__ - INFO - ============================================================
2025-11-05 21:07:18,978 - __main__ - INFO - ============================================================
2025-11-05 21:07:18,978 - __main__ - INFO -   Performance Summary
2025-11-05 21:07:18,978 - __main__ - INFO - ============================================================
2025-11-05 21:07:18,978 - __main__ - INFO - 
run_single_pipeline:
2025-11-05 21:07:18,978 - __main__ - INFO -   Count: 1
2025-11-05 21:07:18,978 - __main__ - INFO -   Total: 5062.33s
2025-11-05 21:07:18,978 - __main__ - INFO -   Avg: 5062.33s
2025-11-05 21:07:18,978 - __main__ - INFO -   Min: 5062.33s
2025-11-05 21:07:18,978 - __main__ - INFO -   Max: 5062.33s
2025-11-05 21:07:18,978 - __main__ - INFO - 
track_quality:
2025-11-05 21:07:18,978 - __main__ - INFO -   Count: 6
2025-11-05 21:07:18,978 - __main__ - INFO -   Total: 0.01s
2025-11-05 21:07:18,978 - __main__ - INFO -   Avg: 0.00s
2025-11-05 21:07:18,978 - __main__ - INFO -   Min: 0.00s
2025-11-05 21:07:18,978 - __main__ - INFO -   Max: 0.00s
2025-11-05 21:07:18,978 - __main__ - INFO - No errors or warnings recorded
2025-11-05 21:07:18,979 - __main__ - INFO - 
2025-11-05 21:07:18,979 - quality_tracker - INFO - Starting: generate_quality_report
2025-11-05 21:07:18,980 - quality_tracker - INFO - Quality report saved: c:\scripts\1repo\data\quality\quality_report_20251105_210718.json
2025-11-05 21:07:18,981 - quality_tracker - INFO - Completed: generate_quality_report (0.00s)
2025-11-05 21:07:18,981 - quality_tracker - INFO - ============================================================
2025-11-05 21:07:18,981 - quality_tracker - INFO -   QUALITY REPORT
2025-11-05 21:07:18,981 - quality_tracker - INFO - ============================================================
2025-11-05 21:07:18,981 - quality_tracker - INFO - Generated: 2025-11-05T18:07:18Z
2025-11-05 21:07:18,981 - quality_tracker - INFO - Version: 2.0.0

2025-11-05 21:07:18,981 - quality_tracker - INFO - ------------------------------------------------------------
2025-11-05 21:07:18,981 - quality_tracker - INFO -   Stage: STRUCTURAL
2025-11-05 21:07:18,981 - quality_tracker - INFO - ------------------------------------------------------------
2025-11-05 21:07:18,981 - quality_tracker - INFO - Summary:
2025-11-05 21:07:18,981 - quality_tracker - INFO -   total_runs: 1
2025-11-05 21:07:18,981 - quality_tracker - INFO -   passed_threshold: 1
2025-11-05 21:07:18,982 - quality_tracker - INFO -   failed_threshold: 0
2025-11-05 21:07:18,982 - quality_tracker - INFO -   pass_rate: 100.0%
2025-11-05 21:07:18,982 - quality_tracker - INFO - 
Recent trend (last 1 runs):
2025-11-05 21:07:18,982 - quality_tracker - INFO -   Pass rate: 100.0%
2025-11-05 21:07:18,982 - quality_tracker - INFO - 
2025-11-05 21:07:18,982 - quality_tracker - INFO - ------------------------------------------------------------
2025-11-05 21:07:18,982 - quality_tracker - INFO -   Stage: STRUCTURE_DETECT
2025-11-05 21:07:18,982 - quality_tracker - INFO - ------------------------------------------------------------
2025-11-05 21:07:18,982 - quality_tracker - INFO - Summary:
2025-11-05 21:07:18,982 - quality_tracker - INFO -   total_runs: 1
2025-11-05 21:07:18,982 - quality_tracker - INFO -   passed_threshold: 1
2025-11-05 21:07:18,982 - quality_tracker - INFO -   failed_threshold: 0
2025-11-05 21:07:18,982 - quality_tracker - INFO -   pass_rate: 100.0%
2025-11-05 21:07:18,982 - quality_tracker - INFO - 
Recent trend (last 1 runs):
2025-11-05 21:07:18,982 - quality_tracker - INFO -   Pass rate: 100.0%
2025-11-05 21:07:18,982 - quality_tracker - INFO - 
2025-11-05 21:07:18,982 - quality_tracker - INFO - ------------------------------------------------------------
2025-11-05 21:07:18,982 - quality_tracker - INFO -   Stage: SUMMARIZE
2025-11-05 21:07:18,982 - quality_tracker - INFO - ------------------------------------------------------------
2025-11-05 21:07:18,982 - quality_tracker - INFO - Summary:
2025-11-05 21:07:18,982 - quality_tracker - INFO -   total_runs: 1
2025-11-05 21:07:18,982 - quality_tracker - INFO -   passed_threshold: 1
2025-11-05 21:07:18,982 - quality_tracker - INFO -   failed_threshold: 0
2025-11-05 21:07:18,982 - quality_tracker - INFO -   pass_rate: 100.0%
2025-11-05 21:07:18,983 - quality_tracker - INFO - 
Recent trend (last 1 runs):
2025-11-05 21:07:18,983 - quality_tracker - INFO -   Pass rate: 100.0%
2025-11-05 21:07:18,983 - quality_tracker - INFO - 
2025-11-05 21:07:18,983 - quality_tracker - INFO - ------------------------------------------------------------
2025-11-05 21:07:18,983 - quality_tracker - INFO -   Stage: EXTENDED
2025-11-05 21:07:18,983 - quality_tracker - INFO - ------------------------------------------------------------
2025-11-05 21:07:18,983 - quality_tracker - INFO - Summary:
2025-11-05 21:07:18,983 - quality_tracker - INFO -   total_runs: 1
2025-11-05 21:07:18,983 - quality_tracker - INFO -   passed_threshold: 1
2025-11-05 21:07:18,983 - quality_tracker - INFO -   failed_threshold: 0
2025-11-05 21:07:18,983 - quality_tracker - INFO -   pass_rate: 100.0%
2025-11-05 21:07:18,983 - quality_tracker - INFO - 
Recent trend (last 1 runs):
2025-11-05 21:07:18,983 - quality_tracker - INFO -   Pass rate: 100.0%
2025-11-05 21:07:18,983 - quality_tracker - INFO - 
2025-11-05 21:07:18,983 - quality_tracker - INFO - ------------------------------------------------------------
2025-11-05 21:07:18,983 - quality_tracker - INFO -   Stage: FINALIZE
2025-11-05 21:07:18,983 - quality_tracker - INFO - ------------------------------------------------------------
2025-11-05 21:07:18,983 - quality_tracker - INFO - Summary:
2025-11-05 21:07:18,983 - quality_tracker - INFO -   total_runs: 1
2025-11-05 21:07:18,983 - quality_tracker - INFO -   passed_threshold: 1
2025-11-05 21:07:18,983 - quality_tracker - INFO -   failed_threshold: 0
2025-11-05 21:07:18,983 - quality_tracker - INFO -   pass_rate: 100.0%
2025-11-05 21:07:18,983 - quality_tracker - INFO - 
Recent trend (last 1 runs):
2025-11-05 21:07:18,983 - quality_tracker - INFO -   Pass rate: 100.0%
2025-11-05 21:07:18,983 - quality_tracker - INFO - 
2025-11-05 21:07:18,983 - quality_tracker - INFO - ------------------------------------------------------------
2025-11-05 21:07:18,983 - quality_tracker - INFO -   Stage: CHUNK
2025-11-05 21:07:18,983 - quality_tracker - INFO - ------------------------------------------------------------
2025-11-05 21:07:18,983 - quality_tracker - INFO - Summary:
2025-11-05 21:07:18,983 - quality_tracker - INFO -   total_runs: 1
2025-11-05 21:07:18,983 - quality_tracker - INFO -   passed_threshold: 1
2025-11-05 21:07:18,983 - quality_tracker - INFO -   failed_threshold: 0
2025-11-05 21:07:18,983 - quality_tracker - INFO -   pass_rate: 100.0%
2025-11-05 21:07:18,983 - quality_tracker - INFO - 
Recent trend (last 1 runs):
2025-11-05 21:07:18,984 - quality_tracker - INFO -   Pass rate: 100.0%
2025-11-05 21:07:18,984 - quality_tracker - INFO - 
2025-11-05 21:07:18,984 - quality_tracker - INFO - ------------------------------------------------------------
2025-11-05 21:07:18,984 - quality_tracker - INFO -   PERFORMANCE SUMMARY
2025-11-05 21:07:18,984 - quality_tracker - INFO - ------------------------------------------------------------
2025-11-05 21:07:18,984 - quality_tracker - INFO - track_quality:
2025-11-05 21:07:18,984 - quality_tracker - INFO -   Count: 6, Avg: 0.00s
2025-11-05 21:07:18,984 - quality_tracker - INFO - run_single_pipeline:
2025-11-05 21:07:18,984 - quality_tracker - INFO -   Count: 1, Avg: 5062.33s
2025-11-05 21:07:18,984 - __main__ - INFO - 
2025-11-05 21:07:18,984 - validate - INFO - ============================================================
2025-11-05 21:07:18,984 - validate - INFO -   Validation Summary
2025-11-05 21:07:18,984 - validate - INFO - ============================================================
2025-11-05 21:07:18,984 - validate - INFO - Overall Results:
2025-11-05 21:07:18,984 - validate - INFO -   total_datasets: 2
2025-11-05 21:07:18,984 - validate - INFO -   valid_datasets: 1
2025-11-05 21:07:18,984 - validate - INFO -   invalid_datasets: 1
2025-11-05 21:07:18,984 - validate - INFO -   total_errors: 2
2025-11-05 21:07:18,984 - validate - INFO -   total_warnings: 30
2025-11-05 21:07:18,984 - validate - INFO -   success_rate: 0.5000
2025-11-05 21:07:18,984 - validate - INFO -   timestamp: 2025-11-05T18:07:18.984333
2025-11-05 21:07:18,984 - validate - INFO - 
Per-dataset results:
2025-11-05 21:07:18,984 - validate - INFO -   ✅ VALID - ядро_2025-08-29.dataset.jsonl (errors: 0, warnings: 30)
2025-11-05 21:07:18,984 - validate - INFO -   ❌ INVALID - ядро_2025-08-29.dataset.jsonl (errors: 2, warnings: 0)
